{
  "kind": "scip-query-attempt",
  "schemaVersion": 1,
  "attemptId": "SQA-B11782818F89A225F3B886E3856E28DA",
  "collaborationDomainId": "5ea57d1a-936c-4c91-b58f-5d61e45173a5",
  "changeId": "SQC-DED67E74D3898BDCA85766BE8D3C93AF",
  "intendedCondition": "The obligation lifecycle is executable, documented, merge-safe, and passes its required repository verification",
  "action": {
    "family": "repository-verification",
    "summary": "Verify the obligation lifecycle with formatting, lint, build, API, full tests, architecture, migration, duplication, parameter, and changed-surface gates",
    "effectClass": "read-only"
  },
  "evidenceReceipts": [
    {
      "schemaVersion": 2,
      "observedAt": "2026-07-31T05:02:24.683Z",
      "facts": {
        "collaborationDomain": {
          "schemaVersion": 1,
          "canonicalizationVersion": 1,
          "hashAlgorithm": "sha256",
          "projection": {
            "name": "scip-query:collaboration-domain",
            "version": 1
          },
          "digest": "65fa7070a947c694f38de6708f2444d2bc2642785dcdb898d24a0401b41fb3c3"
        },
        "workspaceInstance": {
          "schemaVersion": 1,
          "canonicalizationVersion": 1,
          "hashAlgorithm": "sha256",
          "projection": {
            "name": "scip-query:workspace-instance",
            "version": 1
          },
          "digest": "f53b738aebdbca65df7f5d79a4bfc01cb854528c2a00705171682a625937c0c4"
        },
        "wholeContent": {
          "schemaVersion": 1,
          "canonicalizationVersion": 1,
          "hashAlgorithm": "sha256",
          "projection": {
            "name": "scip-query:repository-content",
            "version": 1
          },
          "digest": "5bea4d29a997d39c59c1b728ab6aeadc811e808ed153aa6e695e504c8c415763"
        },
        "relevantInputs": [
          {
            "subject": "scip-query:index-inputs",
            "identity": {
              "schemaVersion": 1,
              "canonicalizationVersion": 1,
              "hashAlgorithm": "sha256",
              "projection": {
                "name": "scip-query:index-inputs",
                "version": 2
              },
              "digest": "c57663aa4eb55795a8bfd079f490c5666c91850082accfb1fb83043a60b9d215"
            }
          }
        ],
        "index": {
          "generation": {
            "schemaVersion": 1,
            "canonicalizationVersion": 1,
            "hashAlgorithm": "sha256",
            "projection": {
              "name": "scip-query:index-generation",
              "version": 1
            },
            "digest": "6abf8f14ad3e014e8e810b2b9f12a8d125577d03b06aa4de161f539c7921fd45"
          },
          "inputs": {
            "schemaVersion": 1,
            "canonicalizationVersion": 1,
            "hashAlgorithm": "sha256",
            "projection": {
              "name": "scip-query:index-inputs",
              "version": 2
            },
            "digest": "c57663aa4eb55795a8bfd079f490c5666c91850082accfb1fb83043a60b9d215"
          },
          "source": "immutable"
        }
      },
      "observedSources": [
        {
          "kind": "index-generation",
          "identity": {
            "schemaVersion": 1,
            "canonicalizationVersion": 1,
            "hashAlgorithm": "sha256",
            "projection": {
              "name": "scip-query:index-generation",
              "version": 1
            },
            "digest": "6abf8f14ad3e014e8e810b2b9f12a8d125577d03b06aa4de161f539c7921fd45"
          }
        },
        {
          "kind": "repository-snapshot",
          "identity": {
            "schemaVersion": 1,
            "canonicalizationVersion": 1,
            "hashAlgorithm": "sha256",
            "projection": {
              "name": "scip-query:repository-content",
              "version": 1
            },
            "digest": "5bea4d29a997d39c59c1b728ab6aeadc811e808ed153aa6e695e504c8c415763"
          }
        }
      ],
      "stabilityProofs": [
        {
          "source": "index-generation",
          "kind": "immutable"
        },
        {
          "source": "repository-snapshot",
          "kind": "fixed-snapshot"
        }
      ],
      "diagnostics": {
        "clean": false,
        "headCommit": "f9fef90c39996f526299ff66c83eea70e1b873fd",
        "treeOid": "a3eba5cc4c05313d13a97644e23f0295ae80dbfb"
      }
    }
  ],
  "observedEffect": "Formatting, lint, build, the 72-path API contract, 2,261 tests, architecture, migration, duplication, parameter, and changed-surface checks passed",
  "outcome": "succeeded",
  "idempotency": {
    "version": 1,
    "algorithm": "sha256",
    "keyDigest": "b11782818f89a225f3b886e3856e28da3119a613d15ddaa2f785adc9555f3d58",
    "requestDigest": "52596feb7aa03ed73758bc98d79ec2b1baf3a26949924c0182c070bbb108b3b2"
  },
  "createdAt": "2026-07-31T05:02:53.428Z",
  "writer": {
    "tool": "scip-query",
    "version": "0.20.0"
  }
}
